{
  "schema_version": 7,
  "package_id": "p4-b0-value-screen-run-authorization-v7",
  "date": "2026-08-09",
  "status": "authorized_gpu4_request_id_canonicalization_value_screen_only",
  "prior_authorization": {
    "path": "research/97_composition_runtime/data/p4/p4_b0_run_authorization_v6.json",
    "sha256": "f3348821c2f8c8ed6bbb74df620c51a33e88eec3b3b0971cc64637e664c4afca",
    "disposition": "consumed_zero_capture_request_identity_failure"
  },
  "failed_attempt": {
    "path": "research/97_composition_runtime/data/p4/run_b0_value_screen_v5/failure.json",
    "sha256": "9987de10a4106c135f221fd4c48515cd46db8809366203f0ea5feb46ce34f05c",
    "capture_count": 0,
    "score_emitted": false,
    "preserve_without_resume": true,
    "failure_scope": "request_identity_normalization_mismatch"
  },
  "request_id_repair": {
    "state": "pass",
    "shared_helper": "canonicalize_p4_request_ids",
    "randomization_policy": "preserve_vllm_internal_request_id_randomization",
    "disable_randomization_allowed": false,
    "accepted_forms": [
      "exact_frozen_request_id",
      "frozen_request_id_plus_eight_lowercase_hex"
    ],
    "canonical_output": "exact_frozen_request_id",
    "consumers": [
      "same_event_recorder",
      "atomic_ingress_analyzer"
    ],
    "fail_closed_cases": [
      "malformed_suffix",
      "unknown_request_id",
      "canonical_collision",
      "request_order_drift"
    ]
  },
  "retained_evidence": {
    "atomic_ingress_proof": {
      "authorization": {
        "path": "research/97_composition_runtime/data/p4/p4_b0_atomic_ingress_proof_authorization_v2.json",
        "sha256": "9811fc0c2a22edd7a127df4a405bd9d66263106becbc000321e54c4b26155983"
      },
      "result": {
        "path": "research/97_composition_runtime/data/p4/run_b0_atomic_ingress_proof_v2/proof.json",
        "sha256": "d3c92a20d9fa41ed92131b1b704b32c4f2a64b984574cfe37b18d545292307e2"
      },
      "trace": {
        "path": "research/97_composition_runtime/data/p4/run_b0_atomic_ingress_proof_v2/koff_trace.jsonl",
        "sha256": "09f7e070987827a2970e2e9bc413c4083267ed65231b6acae9ab820d02bec8bc"
      },
      "decision": "pass",
      "engine_core_class": "InprocClient",
      "v1_multiprocessing": false,
      "initial_prefill_request_count": 8,
      "first_decode_request_count": 8,
      "first_decode_query_widths": [1, 1, 1, 1, 1, 1, 1, 1],
      "first_decode_exclusion_reasons": [],
      "preemptions": 0,
      "recomputed_tokens": 0,
      "shared_target_kv_blocks": 22090,
      "shared_target_kv_layer_count": 36,
      "target_draft_weight_alias_count": 291,
      "scored": false
    },
    "resource_probe": {
      "authorization": {
        "path": "research/97_composition_runtime/data/p4/p4_b0_full_prefill_resource_repair_probe_authorization.json",
        "sha256": "0db3e70bb56087ab7c5213149202aca6018839ca15be26c4546d9cd726e19e53"
      },
      "result": {
        "path": "research/97_composition_runtime/data/p4/p4_b0_full_prefill_resource_repair_probe.json",
        "sha256": "1fd328dadaa876158cb786d9d948a53553625411e03cecea1b1da2f56bc07552"
      },
      "decision": "pass",
      "gpu_memory_utilization": 0.96,
      "num_gpu_blocks": 22113,
      "minimum_launch_blocks": 21682,
      "headroom_blocks": 431,
      "requests_executed": 0
    },
    "serving_chunked_prefill_boundary": {
      "scope": "post_measurement_real_serving_diagnosis",
      "max_num_batched_tokens": 8192,
      "chunked_prefill_enabled": true,
      "gpu_memory_utilization": 0.9,
      "measurement_override_is_serving_default": false,
      "mixed_prefill_decode_diagnosis_required": true
    }
  },
  "frozen_inputs": {
    "prompt_manifest": {
      "path": "research/97_composition_runtime/data/p4/p4_b0_prompt_manifest.json",
      "sha256": "10de0f73897c08b278d532a5764d3e45ccb67dbc52c1dc9d1e85a3da4c54ad93"
    },
    "prompt_bundle": {
      "path": "research/97_composition_runtime/data/p4/p4_b0_prompt_tokens.jsonl.gz",
      "sha256": "0615cf0174bc476dcc744cb947440b09be4b61043685a262e62f573821de1506"
    },
    "scorer_contract": {
      "path": "research/97_composition_runtime/data/p4/p4_b0_runner_scorer_contract.json",
      "sha256": "6bb1de6a2b13725c5b8d3637e024da2dd52e18212a504b9bd384e73a90274736"
    }
  },
  "source_artifacts": {
    "matrix_runner": {
      "path": "research/97_composition_runtime/scripts/run_p4_b0_value_screen.py",
      "sha256": "7ba61a5ca204b58354413a9427e3dad2e7d07a82329b5857a351841e53928fe2"
    },
    "runner_tests": {
      "path": "research/97_composition_runtime/tests/test_p4_b0_capture_runner.py",
      "sha256": "4f98118b91790b5a12c22e1f7f1b014a20d4408df13942e42d1328bdd2610f74"
    },
    "conformance_tests": {
      "path": "research/97_composition_runtime/tests/test_p4_b0_capture_runner_conformance.py",
      "sha256": "3c5021a39286cfbc2bf6209fdd05597f1175bd73b9616a7926340cd6d5999d37"
    },
    "conformance_validator": {
      "path": "research/97_composition_runtime/scripts/validate_p4_b0_capture_runner_conformance.py",
      "sha256": "ab22966b5b36decd28e3670bf5aa5d82a8dffaa60f8de5a95836e721cb4a25b7"
    },
    "runtime_tests": {
      "path": "tests/v1/spec_decode/test_koff_runtime.py",
      "sha256": "3dcd297faad91b7a76480d738600df5106ea499f9062e9307f001027658c0431"
    },
    "recorder_tests": {
      "path": "research/97_composition_runtime/tests/test_p4_live_recorder.py",
      "sha256": "97b7b546d5162d9170b00bc9f372c6bc6c3b8aabdcc0ea2da30dee474c592d1a"
    },
    "atomic_ingress_runner": {
      "path": "research/97_composition_runtime/scripts/run_p4_b0_atomic_ingress_proof.py",
      "sha256": "30e07ca92a9fc2fc5ee63f46dbc04659a490d5e82f952e6040a263d4f6528b1e"
    },
    "atomic_ingress_tests": {
      "path": "research/97_composition_runtime/tests/test_p4_b0_atomic_ingress_proof.py",
      "sha256": "a9e2097144938fae5a3ccb2c28aec0f2c4ea3bc3fac29b90548669ab1f2122d0"
    },
    "input_processor": {
      "path": "vllm/v1/engine/input_processor.py",
      "sha256": "c5673988c0f7cfec268220e3f044e718702c015a4f236c020937cfd40a793f15"
    },
    "environment": {
      "path": "vllm/envs.py",
      "sha256": "c8dcc3df94ee613dc97de37cef060b8e156d1787daf8776487376f0f1ca0da20"
    },
    "engine_args": {
      "path": "vllm/engine/arg_utils.py",
      "sha256": "f1a32e2207e9ed2f0d954e3e6457effca17ca907cb0cf17bba2ca8bde855a719"
    },
    "llm_engine": {
      "path": "vllm/v1/engine/llm_engine.py",
      "sha256": "17e5edfc625c77e9663368c7d69136e5e5935ee81608a65be3996411d502225e"
    },
    "engine_core_client": {
      "path": "vllm/v1/engine/core_client.py",
      "sha256": "8348c1bac859c6a82b631d4518b1875b0364ed42818bc1f3c2e2f556682bc549"
    },
    "uniproc_executor": {
      "path": "vllm/v1/executor/uniproc_executor.py",
      "sha256": "4625c8e59aef1482600b02204701d348d7f716427581d3cf23b06bff9b056abe"
    },
    "scheduler": {
      "path": "vllm/v1/core/sched/scheduler.py",
      "sha256": "a4434420cc64503828fe8fac29ba11cd282cdf4d9dca4e7592dd92305ef69ad7"
    },
    "koff_runtime": {
      "path": "vllm/v1/spec_decode/koff_runtime.py",
      "sha256": "75d55eb7cc84589e035fadf725dd16a81908dfc6b4da46b67e84587226e7259f"
    },
    "model_runner": {
      "path": "vllm/v1/worker/gpu_model_runner.py",
      "sha256": "c6e4ba93b3054276a12ba61c4a488c357bc695bb6a794756fd610b5625edbfd1"
    },
    "draft_model": {
      "path": "vllm/v1/spec_decode/draft_model.py",
      "sha256": "297db1337cae6490c4212441221960d1f1751ea3e87f30da750382089fc3f4f0"
    },
    "draft_proposer": {
      "path": "vllm/v1/spec_decode/llm_base_proposer.py",
      "sha256": "d57e1ff4fad5ddfc7379a606780fe62188452adab923b95db6ef73734db00562"
    },
    "sampler_backend": {
      "path": "vllm/v1/sample/ops/topk_topp_sampler.py",
      "sha256": "35b9a1ffeb1e50b73b0ddd1ffc0f968910ee21cf9cc5455dd879fde547b6ddc1"
    },
    "adapter": {
      "path": "research/97_composition_runtime/scripts/adapt_p4_b0_same_event.py",
      "sha256": "32b1ad037d4bc7cfc288bfb50e3a8d50a8c3246f14544e33c04a587f6f70e789"
    },
    "scorer": {
      "path": "research/97_composition_runtime/scripts/score_p4_b0.py",
      "sha256": "092a689aa9c60619e51dac6531aca58991644e6f5fdffad4ae880876b4a76fb4"
    },
    "authorization_schema": {
      "path": "research/97_composition_runtime/schemas/p4_b0_run_authorization_v7.schema.json",
      "sha256": "df97d04b4c6c3ee5ab2a7ce0e53f6b3c937a173029b636a8f2e28f7ca89fac9a"
    },
    "authorization_validator": {
      "path": "research/97_composition_runtime/scripts/validate_p4_b0_run_authorization_v7.py",
      "sha256": "db00a073ffc3f8a1b2425cd872e7bc77b5bc2cb2d2c067d2be3cbf73fe7f5efc"
    },
    "authorization_tests": {
      "path": "research/97_composition_runtime/tests/test_p4_b0_run_authorization_v7.py",
      "sha256": "453da221f699e732cdaf4b21b22b1432610c28d13275bf1c693c138488396574"
    }
  },
  "run_contract": {
    "base_authorization": {
      "path": "research/97_composition_runtime/data/p4/p4_b0_run_authorization_v2.json",
      "sha256": "73b3416517ca4a8dcd07d7bd5c0b3c468aa6145eca05afca9954ebc929c5b09a"
    },
    "invocation": {
      "runner_path": "research/97_composition_runtime/scripts/run_p4_b0_value_screen.py",
      "argv": [
        ".venv/bin/python",
        "research/97_composition_runtime/scripts/run_p4_b0_value_screen.py",
        "--authorization",
        "research/97_composition_runtime/data/p4/p4_b0_run_authorization_v7.json",
        "--output-dir",
        "research/97_composition_runtime/data/p4/run_b0_value_screen_v6"
      ],
      "output_dir": "research/97_composition_runtime/data/p4/run_b0_value_screen_v6",
      "overwrite_allowed": false,
      "runner_exists": true,
      "launchable_now": true
    }
  },
  "decision": {
    "state": "approve",
    "scope": "gpu4_request_id_canonicalization_value_screen_v7_only",
    "basis": [
      "v6_zero_capture_failure_preserved",
      "strict_request_id_canonicalization_tested",